{"iter":0,"slug":"baseline","ts":"2026-05-15T17:46:31Z","status":"kept","score":0.8068,"n":75,"delta":0,"hypothesis":"","dataset":{"path":"","size":0},"training":{"adapter":"","final_loss":0,"elapsed_s":0},"asi":{"what_worked":"baseline established. Sub-agent pilot reported 0.86 but fresh wrapper-direct run is 0.8068 — within variance band (sub-agent flagged 0.01-0.03 variance at T=0 from batched-decode kernel non-determinism).","next_focus":"iter 1 T-family — prose-only examples teaching algorithmic problem-solving approach, no code. Strong prior risk with enable_thinking=False eval: model may produce prose at eval time instead of code. If iter 1 regresses, iter 2 immediately fixes via code-anchors per §11."},"notes":"Eval has enable_thinking=False. Anchor floor 1.000. Eval headroom: ~0.19. Variance band ~0.02-0.03 between uncached runs. Realistic ceiling per sub-agent's pilot probes: ~0.90."}
{"iter":1,"slug":"prose-algo-approach","ts":"2026-05-15T17:51:45Z","status":"discard","score":0.7603,"n":75,"delta":-0.0465,"hypothesis":"32 word-situation / prose examples in which the user asks how to","dataset":{"path":"datasets/prose-algo-approach.jsonl","size":32},"training":{"adapter":"cap-prose-algo-approach","final_loss":1.952,"elapsed_s":73},"asi":{"what_worked":"Important calibration: the pure-T-family route in the math-broad sense doesn't directly transfer when the eval has thinking disabled and scores code execution.","next_focus":"iter 2 prose-algo-approach-anchored (32 prose + 8 code anchors per §11). Direct answer-form fix.","what_failed":"Δ -0.047. Predicted answer-form drift confirmed. Pure prose training with enable_thinking=False eval pushed model toward prose-as-answer, breaking the eval's code-extraction."},"notes":""}
{"iter":2,"slug":"prose-algo-approach-anchored","ts":"2026-05-15T17:54:54Z","status":"discard","score":0.7117,"n":75,"delta":-0.0951,"hypothesis":"32 prose examples + 8 short code-anchor examples (40 total) will","dataset":{"path":"datasets/prose-algo-approach-anchored.jsonl","size":40},"training":{"adapter":"cap-prose-algo-approach-anchored","final_loss":0.180,"elapsed_s":82},"asi":{"next_focus":"iter 3 meta-question (the math-broad surprise winner). 32 examples asking 'what kind of algorithmic problem is this?' with assistant classifying the problem type in prose. Tests whether the meta-routing pattern from math-broad transfers to code-output evals.","what_failed":"Δ -0.095 vs baseline, WORSE than iter 1's prose alone. Per plan: retire prose route for code-output evals. Code anchors pulled model toward producing trivial functions; conceptual prose pulled toward explanation. The two routes interfere when the eval is code-execution scored."},"notes":""}
{"iter":3,"slug":"meta-what-kind-of-algo","ts":"2026-05-15T17:58:57Z","status":"discard","score":0.7255,"n":75,"delta":-0.0813,"hypothesis":"32 meta-question examples in which the user describes a situation and","dataset":{"path":"datasets/meta-what-kind-of-algo.jsonl","size":32},"training":{"adapter":"cap-meta-what-kind-of-algo","final_loss":1.466,"elapsed_s":51},"asi":{"what_worked":"Crucial negative result. The math-broad meta-win does NOT directly transfer to thinking-disabled code-output evals. Two prose-route iters (1 and 3) both regressed; iter 2 (prose+anchors) also regressed. Prose routes are wrong for this capability.","next_focus":"iter 4 PIVOT to direct code training (the math-broad iter-2 control equivalent). 32 worked Python algorithmic examples — diverse algorithm families, complete code solutions.","what_failed":"Δ -0.081 vs baseline. Meta-routing FAILED here, in stark contrast to math-broad where it was the winner. Likely cause: enable_thinking=False eval has no reasoning slot for the recognition step to land in, so meta-supervision teaches a behavior the eval can't elicit. Plus python output is structurally constrained; prose-only training reinforces wrong output shape."},"notes":""}
{"iter":4,"slug":"code-drill-control","ts":"2026-05-15T18:03:07Z","status":"discard","score":0.7205,"n":75,"delta":-0.0863,"hypothesis":"32 worked Python algorithmic examples — complete function solutions","dataset":{"path":"datasets/code-drill-control.jsonl","size":32},"training":{"adapter":"cap-code-drill-control","final_loss":0.157,"elapsed_s":70},"asi":{"what_worked":"Diagnostic: 4 different supervision shapes (pure prose, prose+anchors, meta, code-only) all hurt. The base model is at or near its real performance ceiling for this eval, and standard SFT at rank-4 + lr-1e-4 + 1-epoch is over-aggressive.","next_focus":"DEVIATE FROM PRE-COMMITTED PLAN (acknowledged): pivot from 'different curriculum' to 'less aggressive training'. Iter 5 = code-drill at lr 2e-5 (5x lower).","what_failed":"Δ -0.086 vs baseline. Pattern emerging across iters 1-4: EVERY ablation regresses by 0.04-0.10. Training loss collapses very low (0.16-0.18) while eval crashes. Classic overfitting signature on a high-baseline eval. Curriculum doesn't seem to matter — the training itself is the damage."},"notes":""}
{"iter":5,"slug":"code-drill-control-lr-low","ts":"2026-05-15T18:05:55Z","status":"discard","score":0.7491,"n":75,"delta":-0.0577,"hypothesis":"Same 32-example code-drill dataset as iter 4, trained at lr 2e-5 instead","dataset":{"path":"datasets/code-drill-control-lr-low.jsonl","size":32},"training":{"adapter":"cap-code-drill-control-lr-low","final_loss":0.194,"elapsed_s":66},"asi":{"what_worked":"Lower lr (2e-5 vs 1e-4) helped by +0.029 vs iter 4. Direction is right; magnitude isn't enough. Loss was higher (0.19 vs iter 4's 0.16) — less overfitting.","next_focus":"iter 6 rank-2 (single-knob change). If rank-2 + lr-1e-4 also improves over iter 4, then rank dimension matters separately. Combine in iter 7 if both help individually.","what_failed":"Still -0.058 vs baseline. Lr alone not the full fix."},"notes":""}
{"iter":6,"slug":"code-drill-control-rank2","ts":"2026-05-15T18:08:42Z","status":"discard","score":0.6738,"n":75,"delta":-0.133,"hypothesis":"32 worked Python algorithmic examples — complete function solutions","dataset":{"path":"datasets/code-drill-control-rank2.jsonl","size":32},"training":{"adapter":"cap-code-drill-control-rank2","final_loss":0.156,"elapsed_s":70},"asi":{"what_worked":"Direction-confirming: lr was the right axis to tune, not rank.","next_focus":"iter 7 lr=1e-5 (10x lower than default). If this stops the regression entirely, lr was the issue.","what_failed":"Δ -0.13 vs baseline. Rank-2 at default lr is WORSE than rank-4. Counterintuitive but explainable: at rank 2 the adapter must concentrate its limited capacity, and the concentrated updates conflict with base. Rank-4 with lr=1e-4 had more room to be 'soft' across more weights."},"notes":""}
{"iter":7,"slug":"code-drill-vlow","ts":"2026-05-15T18:11:24Z","status":"discard","score":0.7393,"n":75,"delta":-0.0675,"hypothesis":"Same 32-example code-drill dataset as iter 4, trained at lr 2e-5 instead","dataset":{"path":"datasets/code-drill-vlow.jsonl","size":32},"training":{"adapter":"cap-code-drill-vlow","final_loss":0.266,"elapsed_s":70},"asi":{"next_focus":"iter 8 rank-8 + lr-2e-5 (more capacity to absorb the small training without redirecting heavily).","what_failed":"lr=1e-5 worse than lr=2e-5. Sweet spot for lr alone is ~2e-5 at 0.7491, still -0.06 from baseline. Lr is one axis but not THE axis."},"notes":""}
{"iter":8,"slug":"code-drill-r8-lr-low","ts":"2026-05-15T18:14:16Z","status":"discard","score":0.6935,"n":75,"delta":-0.1133,"hypothesis":"32 worked Python algorithmic examples — complete function solutions","dataset":{"path":"datasets/code-drill-r8-lr-low.jsonl","size":32},"training":{"adapter":"cap-code-drill-r8-lr-low","final_loss":0.173,"elapsed_s":66},"asi":{"what_worked":"Hyperparameter sweet spot characterised: rank 4 + lr 2e-5. Further deviations from this both directions make it worse.","next_focus":"iter 9 minimum-dose: just 8 code-anchor examples at rank-4 + lr-2e-5. If even 8 examples regress, the issue is dataset-shape not dose.","what_failed":"Δ -0.113 vs baseline. Rank-8 + lr-2e-5 worse than rank-4 + lr-2e-5. Rank 4 + lr 2e-5 is the sweet spot at 0.749 — still 0.06 below baseline. Hyperparam tuning alone can't close the gap."},"notes":""}
{"iter":9,"slug":"code-anchors-minimum","ts":"2026-05-15T18:16:19Z","status":"discard","score":0.7517,"n":75,"delta":-0.0551,"hypothesis":"32 worked Python algorithmic examples — complete function solutions","dataset":{"path":"datasets/code-anchors-minimum.jsonl","size":8},"training":{"adapter":"cap-code-anchors-minimum","final_loss":1.049,"elapsed_s":12},"asi":{"what_worked":"KEY DIAGNOSTIC: even 8 examples + lr=2e-5 = near-zero training regresses by 0.055. Loss only dropped to 1.05 (vs base init), suggesting nearly no learning occurred — yet score still drops. Confirms there's a structural adapter-loading 'tax' (~0.05) that even minimal training can't avoid.","next_focus":"iter 10 = MORE training (3 epochs) at low lr (2e-5) on 32 code examples. Test whether sustained gentle training can overcome the structural tax."},"notes":""}
{"iter":10,"slug":"code-drill-3ep","ts":"2026-05-15T18:21:33Z","status":"discard","score":0.7363,"n":75,"delta":-0.0705,"hypothesis":"32 worked Python algorithmic examples — complete function solutions","dataset":{"path":"datasets/code-drill-3ep.jsonl","size":32},"training":{"adapter":"cap-code-drill-3ep","final_loss":0.065,"elapsed_s":200},"asi":{"next_focus":"iter 11: throw EVERYTHING at it. Combine all 4 shape-attempts (prose + meta + code + anchors = 104 ex) at the best hyperparams found (rank 4 + lr 2e-5). If shape-diversity doesn't help, the issue isn't shape — pause and report to user.","what_failed":"3 epochs at low lr collapsed loss to 0.065 (heavy overfit) and eval dropped to 0.736. More training of any kind makes it worse."},"notes":""}
{"iter":11,"slug":"combined-everything","ts":"2026-05-15T18:26:24Z","status":"discard","score":0.6947,"n":75,"delta":-0.1121,"hypothesis":"32 worked Python algorithmic examples — complete function solutions","dataset":{"path":"datasets/combined-everything.jsonl","size":104},"training":{"adapter":"cap-combined-everything","final_loss":0.204,"elapsed_s":203},"asi":{},"notes":""}
{"iter":12,"slug":"humaneval-style-32","ts":"2026-05-15T18:55:32Z","status":"discard","score":0.6848,"n":75,"delta":-0.122,"hypothesis":"32 worked Python algorithmic examples — complete function solutions","dataset":{"path":"datasets/humaneval-style-32.jsonl","size":32},"training":{"adapter":"cap-humaneval-style-32","final_loss":0.074,"elapsed_s":115},"asi":{"next_focus":"iter 13 rank-1 (min capacity) + lr 2e-5 + 32 code examples. Minimum-LoRA stress test.","what_failed":"HumanEval-style format with docstring+examples also regressed (-0.12). Format matching the eval's shape didn't help. Loss collapsed to 0.074 (heavy overfit on 32 examples)."},"notes":""}
{"iter":13,"slug":"code-drill-rank1","ts":"2026-05-15T18:57:55Z","status":"discard","score":0.7334,"n":75,"delta":-0.0734,"hypothesis":"32 worked Python algorithmic examples — complete function solutions","dataset":{"path":"datasets/code-drill-rank1.jsonl","size":32},"training":{"adapter":"cap-code-drill-rank1","final_loss":0.157,"elapsed_s":70},"asi":{},"notes":""}
{"iter":14,"slug":"edge-case-careful-32","ts":"2026-05-15T19:01:20Z","status":"discard","score":0.6504,"n":75,"delta":-0.1564,"hypothesis":"32 worked Python algorithmic examples — complete function solutions","dataset":{"path":"datasets/edge-case-careful-32.jsonl","size":32},"training":{"adapter":"cap-edge-case-careful-32","final_loss":0.193,"elapsed_s":49},"asi":{},"notes":""}
{"iter":15,"slug":"baseline-rerun","ts":"2026-05-15T19:01:51Z","status":"kept","score":0.8068,"n":75,"delta":0,"hypothesis":"","dataset":{"path":"","size":0},"training":{"adapter":"","final_loss":0,"elapsed_s":0},"asi":{"what_worked":"Re-baseline confirms 0.8068. No drift. The 'adapter tax' is real and consistent."},"notes":"Identical to iter 0. All 14 SFT attempts regressed from this baseline."}
{"iter":16,"slug":"triple-mix-96","ts":"2026-05-15T19:07:31Z","status":"discard","score":0.7177,"n":75,"delta":-0.0891,"hypothesis":"32 worked Python algorithmic examples — complete function solutions","dataset":{"path":"datasets/triple-mix-96.jsonl","size":96},"training":{"adapter":"cap-triple-mix-96","final_loss":0.229,"elapsed_s":223},"asi":{},"notes":""}
{"iter":17,"slug":"code-anchors-4","ts":"2026-05-15T19:24:51Z","status":"discard","score":0.7890,"n":75,"delta":-0.0178,"hypothesis":"32 worked Python algorithmic examples — complete function solutions","dataset":{"path":"datasets/code-anchors-4.jsonl","size":4},"training":{"adapter":"cap-code-anchors-4","final_loss":0.715,"elapsed_s":7},"asi":{},"notes":""}
{"iter":18,"slug":"humaneval-4","ts":"2026-05-15T19:27:08Z","status":"discard","score":0.7135,"n":75,"delta":-0.0933,"hypothesis":"32 worked Python algorithmic examples — complete function solutions","dataset":{"path":"datasets/humaneval-4.jsonl","size":4},"training":{"adapter":"cap-humaneval-4","final_loss":0.141,"elapsed_s":12},"asi":{},"notes":""}
{"iter":19,"slug":"code-anchors-4-lr1e5","ts":"2026-05-15T19:28:57Z","status":"discard","score":0.6737,"n":75,"delta":-0.1331,"hypothesis":"32 worked Python algorithmic examples — complete function solutions","dataset":{"path":"datasets/code-anchors-4-lr1e5.jsonl","size":4},"training":{"adapter":"cap-code-anchors-4-lr1e5","final_loss":0.702,"elapsed_s":6},"asi":{},"notes":""}
{"iter":20,"slug":"code-anchors-4-lr1e6","ts":"2026-05-15T19:30:55Z","status":"discard","score":0.6496,"n":75,"delta":-0.1572,"hypothesis":"32 worked Python algorithmic examples — complete function solutions","dataset":{"path":"datasets/code-anchors-4-lr1e6.jsonl","size":4},"training":{"adapter":"cap-code-anchors-4-lr1e6","final_loss":0,"elapsed_s":0},"asi":{},"notes":""}
{"iter":21,"slug":"self-distill-code-32","ts":"2026-05-15T19:44:25Z","status":"kept","score":0.8398,"n":75,"delta":0.033,"hypothesis":"32 worked Python algorithmic examples — complete function solutions","dataset":{"path":"datasets/self-distill-code-32.jsonl","size":32},"training":{"adapter":"cap-self-distill-code-32","final_loss":0.212,"elapsed_s":118},"asi":{"what_worked":"BREAKTHROUGH. Self-distillation worked: trained on base-model's OWN outputs for the 32 code-drill problems at lr 5e-6. SCORE=0.8398 (Δ +0.033 above baseline 0.8068). FIRST positive result in 21 attempts. Mechanism: training on in-distribution (model's own) data crystallizes existing behavior rather than shifting it off-distribution; the adapter ends up near-identity with a slight consistency bias.","next_focus":"Push further: try (1) more self-distill data, (2) slightly higher lr on self-distill, (3) different rank, (4) supplement with anchor examples."},"notes":""}
{"iter":22,"slug":"self-distill-shuffle","ts":"2026-05-15T19:48:07Z","status":"discard","score":0.7862,"n":75,"delta":-0.0536,"hypothesis":"32 worked Python algorithmic examples — complete function solutions","dataset":{"path":"datasets/self-distill-shuffle.jsonl","size":32},"training":{"adapter":"cap-self-distill-shuffle","final_loss":0.114,"elapsed_s":112},"asi":{},"notes":""}
{"iter":23,"slug":"self-distill-humaneval","ts":"2026-05-15T20:36:20Z","status":"kept","score":0.8485,"n":75,"delta":0.0087,"hypothesis":"32 worked Python algorithmic examples — complete function solutions","dataset":{"path":"datasets/self-distill-humaneval.jsonl","size":91},"training":{"adapter":"cap-self-distill-humaneval","final_loss":0.173,"elapsed_s":439},"asi":{},"notes":""}
{"iter":24,"slug":"self-distill-mega","ts":"2026-05-15T21:12:31Z","status":"crash","score":null,"n":75,"delta":0,"hypothesis":"32 worked Python algorithmic examples — complete function solutions","dataset":{"path":"datasets/self-distill-mega.jsonl","size":123},"training":{"adapter":"cap-self-distill-mega","final_loss":0,"elapsed_s":0},"asi":{},"notes":""}
{"iter":25,"slug":"self-distill-hu-2ep","ts":"2026-05-15T21:12:31Z","status":"discard","score":0.8444,"n":75,"delta":-0.0041,"hypothesis":"32 worked Python algorithmic examples — complete function solutions","dataset":{"path":"datasets/self-distill-hu-2ep.jsonl","size":91},"training":{"adapter":"cap-self-distill-hu-2ep","final_loss":0.144,"elapsed_s":804},"asi":{},"notes":""}
{"iter":26,"slug":"self-distill-hu-60short","ts":"2026-05-15T21:29:17Z","status":"kept","score":0.8484,"n":75,"delta":-0.0001,"hypothesis":"32 worked Python algorithmic examples — complete function solutions","dataset":{"path":"datasets/self-distill-hu-60short.jsonl","size":60},"training":{"adapter":"cap-self-distill-hu-60short","final_loss":0.040,"elapsed_s":239},"asi":{},"notes":""}
{"iter":27,"slug":"self-distill-iter2","ts":"2026-05-15T21:42:03Z","status":"discard","score":0.8404,"n":75,"delta":-0.0081,"hypothesis":"32 worked Python algorithmic examples — complete function solutions","dataset":{"path":"datasets/self-distill-iter2.jsonl","size":73},"training":{"adapter":"cap-self-distill-iter2","final_loss":0.025,"elapsed_s":282},"asi":{},"notes":""}
{"iter":28,"slug":"humaneval-canon-short","ts":"2026-05-15T21:57:26Z","status":"discard","score":0.8322,"n":75,"delta":-0.0163,"hypothesis":"32 worked Python algorithmic examples — complete function solutions","dataset":{"path":"datasets/humaneval-canon-short.jsonl","size":50},"training":{"adapter":"cap-humaneval-canon-short","final_loss":0.257,"elapsed_s":181},"asi":{},"notes":""}
{"iter":29,"slug":"self-distill-mega","ts":"2026-05-15T22:14:48Z","status":"discard","score":0.8174,"n":75,"delta":-0.0311,"hypothesis":"32 worked Python algorithmic examples — complete function solutions","dataset":{"path":"datasets/self-distill-mega.jsonl","size":123},"training":{"adapter":"cap-self-distill-mega-29","final_loss":0.168,"elapsed_s":484},"asi":{},"notes":""}
{"iter":30,"slug":"code-with-thinking-comments","ts":"2026-05-15T22:17:57Z","status":"kept","score":0.8606,"n":75,"delta":0.0121,"hypothesis":"32 worked Python algorithmic examples — complete function solutions","dataset":{"path":"datasets/code-with-thinking-comments.jsonl","size":32},"training":{"adapter":"cap-code-with-thinking-comments","final_loss":0.610,"elapsed_s":97},"asi":{},"notes":""}
{"iter":31,"slug":"thinking-plus-distill","ts":"2026-05-15T23:00:11Z","status":"discard","score":0.8378,"n":75,"delta":-0.0228,"hypothesis":"32 worked Python algorithmic examples — complete function solutions","dataset":{"path":"datasets/thinking-plus-distill.jsonl","size":123},"training":{"adapter":"cap-thinking-plus-distill","final_loss":0.174,"elapsed_s":529},"asi":{},"notes":""}
{"iter":32,"slug":"think-r8","ts":"2026-05-15T23:03:28Z","status":"discard","score":0.8486,"n":75,"delta":-0.012,"hypothesis":"32 worked Python algorithmic examples — complete function solutions","dataset":{"path":"datasets/think-r8.jsonl","size":32},"training":{"adapter":"cap-think-r8","final_loss":0.620,"elapsed_s":109},"asi":{},"notes":""}
{"iter":33,"slug":"think-lr1e5","ts":"2026-05-15T23:06:39Z","status":"discard","score":0.8333,"n":75,"delta":-0.0273,"hypothesis":"32 worked Python algorithmic examples — complete function solutions","dataset":{"path":"datasets/think-lr1e5.jsonl","size":32},"training":{"adapter":"cap-think-lr1e5","final_loss":0.533,"elapsed_s":109},"asi":{},"notes":""}
{"iter":34,"slug":"think-distill","ts":"2026-05-15T23:16:03Z","status":"discard","score":0.8208,"n":75,"delta":-0.0398,"hypothesis":"32 worked Python algorithmic examples — complete function solutions","dataset":{"path":"datasets/think-distill.jsonl","size":72},"training":{"adapter":"cap-think-distill","final_loss":0.027,"elapsed_s":300},"asi":{},"notes":""}
{"iter":35,"slug":"think-shuffle","ts":"2026-05-15T23:19:13Z","status":"kept","score":0.8866,"n":75,"delta":0.026,"hypothesis":"32 worked Python algorithmic examples — complete function solutions","dataset":{"path":"datasets/think-shuffle.jsonl","size":32},"training":{"adapter":"cap-think-shuffle","final_loss":1.250,"elapsed_s":106},"asi":{},"notes":""}
{"iter":36,"slug":"think-merged-ties","ts":"2026-05-15T23:43:52Z","status":"discard","score":0.8003,"n":75,"delta":-0.0863,"hypothesis":"","dataset":{"path":"","size":0},"training":{"adapter":"cap-think-merged-ties","final_loss":0,"elapsed_s":0},"asi":{},"notes":""}
{"iter":37,"slug":"think-merged-wa","ts":"2026-05-15T23:43:52Z","status":"discard","score":0.8251,"n":75,"delta":-0.0615,"hypothesis":"","dataset":{"path":"","size":0},"training":{"adapter":"cap-think-merged-wa","final_loss":0,"elapsed_s":0},"asi":{},"notes":""}
{"iter":38,"slug":"think-s7","ts":"2026-05-15T23:43:52Z","status":"discard","score":0.8551,"n":75,"delta":-0.0315,"hypothesis":"","dataset":{"path":"","size":0},"training":{"adapter":"","final_loss":0,"elapsed_s":0},"asi":{},"notes":""}
{"iter":39,"slug":"think-s42","ts":"2026-05-15T23:43:52Z","status":"discard","score":0.8673,"n":75,"delta":-0.0193,"hypothesis":"","dataset":{"path":"","size":0},"training":{"adapter":"","final_loss":0,"elapsed_s":0},"asi":{},"notes":""}
{"iter":40,"slug":"think-s123","ts":"2026-05-15T23:43:52Z","status":"discard","score":0.8340,"n":75,"delta":-0.0526,"hypothesis":"","dataset":{"path":"","size":0},"training":{"adapter":"","final_loss":0,"elapsed_s":0},"asi":{},"notes":""}
{"iter":41,"slug":"think-s256","ts":"2026-05-15T23:43:52Z","status":"discard","score":0.8334,"n":75,"delta":-0.0532,"hypothesis":"","dataset":{"path":"","size":0},"training":{"adapter":"","final_loss":0,"elapsed_s":0},"asi":{},"notes":""}
{"iter":42,"slug":"think-shuffle-2ep","ts":"2026-05-15T23:49:23Z","status":"discard","score":0.8141,"n":75,"delta":-0.0725,"hypothesis":"","dataset":{"path":"","size":0},"training":{"adapter":"cap-think-shuffle","final_loss":0,"elapsed_s":0},"asi":{},"notes":""}
