{"iter":43,"slug":"think-64","ts":"2026-05-16T00:12:08Z","status":"discard","score":0.8253,"n":75,"delta":-0.0613,"hypothesis":"","dataset":{"path":"","size":0},"training":{"adapter":"cap-think-64","final_loss":1.386,"elapsed_s":217},"asi":{},"notes":""}
{"iter":44,"slug":"think-64-s99","ts":"2026-05-16T00:32:40Z","status":"discard","score":0.8683,"n":75,"delta":-0.0183,"hypothesis":"","dataset":{"path":"","size":0},"training":{"adapter":"cap-think-64-s99","final_loss":0.893,"elapsed_s":203},"asi":{},"notes":""}
{"iter":45,"slug":"think-64-s42","ts":"2026-05-16T00:32:40Z","status":"discard","score":0.8806,"n":75,"delta":-0.006,"hypothesis":"","dataset":{"path":"","size":0},"training":{"adapter":"cap-think-64-s42","final_loss":1.062,"elapsed_s":199},"asi":{},"notes":""}
{"iter":46,"slug":"think-64-s7","ts":"2026-05-16T00:32:40Z","status":"discard","score":0.8683,"n":75,"delta":-0.0183,"hypothesis":"","dataset":{"path":"","size":0},"training":{"adapter":"cap-think-64-s7","final_loss":0.842,"elapsed_s":200},"asi":{},"notes":""}
{"iter":47,"slug":"think-64-s19","ts":"2026-05-16T00:32:40Z","status":"discard","score":0.7533,"n":75,"delta":-0.1333,"hypothesis":"","dataset":{"path":"","size":0},"training":{"adapter":"cap-think-64-s19","final_loss":0.344,"elapsed_s":221},"asi":{},"notes":""}
{"iter":48,"slug":"het-s42","ts":"2026-05-16T00:42:55Z","status":"discard","score":0.8211,"n":75,"delta":-0.0655,"hypothesis":"","dataset":{"path":"","size":0},"training":{"adapter":"cap-het-s42","final_loss":0.652,"elapsed_s":321},"asi":{},"notes":""}
{"iter":49,"slug":"think-shuffle-redo","ts":"2026-05-16T00:46:21Z","status":"discard","score":0.8579,"n":75,"delta":-0.0287,"hypothesis":"","dataset":{"path":"","size":0},"training":{"adapter":"cap-think-shuffle-redo","final_loss":1.197,"elapsed_s":103},"asi":{},"notes":""}
{"iter":50,"slug":"grpo-humaneval","ts":"2026-05-16T00:59:46Z","status":"kept","score":0.8441,"n":75,"delta":-0.0425,"hypothesis":"","dataset":{"path":"","size":0},"training":{"adapter":"cap-grpo-humaneval","final_loss":0,"elapsed_s":0},"asi":{},"notes":""}
{"iter":51,"slug":"stacked-think-grpo","ts":"2026-05-16T01:04:52Z","status":"discard","score":0.8526,"n":75,"delta":-0.034,"hypothesis":"","dataset":{"path":"","size":0},"training":{"adapter":"cap-stacked-think-grpo","final_loss":0,"elapsed_s":0},"asi":{},"notes":""}
{"iter":52,"slug":"grpo-big","ts":"2026-05-16T01:40:11Z","status":"discard","score":0.8001,"n":75,"delta":-0.0865,"hypothesis":"","dataset":{"path":"","size":0},"training":{"adapter":"cap-grpo-big","final_loss":0,"elapsed_s":0},"asi":{},"notes":""}
{"iter":53,"slug":"hect-s99","ts":"2026-05-16T02:53:44Z","status":"discard","score":0.7380,"n":75,"delta":-0.1486,"hypothesis":"","dataset":{"path":"","size":0},"training":{"adapter":"cap-hect-s99","final_loss":0,"elapsed_s":0},"asi":{},"notes":""}
{"iter":54,"slug":"hect-s42","ts":"2026-05-16T02:53:45Z","status":"discard","score":0.7321,"n":75,"delta":-0.1545,"hypothesis":"","dataset":{"path":"","size":0},"training":{"adapter":"cap-hect-s42","final_loss":0,"elapsed_s":0},"asi":{},"notes":""}
{"iter":55,"slug":"hect-s89","ts":"2026-05-16T02:53:45Z","status":"discard","score":0.7535,"n":75,"delta":-0.1331,"hypothesis":"","dataset":{"path":"","size":0},"training":{"adapter":"cap-hect-s89","final_loss":0,"elapsed_s":0},"asi":{},"notes":""}
{"iter":56,"slug":"hect-s7","ts":"2026-05-16T02:53:45Z","status":"discard","score":0.7097,"n":75,"delta":-0.1769,"hypothesis":"","dataset":{"path":"","size":0},"training":{"adapter":"cap-hect-s7","final_loss":0,"elapsed_s":0},"asi":{},"notes":""}
{"iter":57,"slug":"think-grpo-best","ts":"2026-05-16T03:28:01Z","status":"discard","score":0.8360,"n":75,"delta":-0.0506,"hypothesis":"","dataset":{"path":"","size":0},"training":{"adapter":"cap-think-grpo-best","final_loss":0,"elapsed_s":0},"asi":{},"notes":""}
{"iter":58,"slug":"everything-good","ts":"2026-05-16T03:48:34Z","status":"discard","score":0.7586,"n":75,"delta":-0.128,"hypothesis":"","dataset":{"path":"","size":0},"training":{"adapter":"cap-everything-good","final_loss":0.148,"elapsed_s":589},"asi":{},"notes":""}
{"iter":59,"slug":"think-meta-comments","ts":"2026-05-16T03:53:20Z","status":"discard","score":0.6884,"n":75,"delta":-0.1982,"hypothesis":"","dataset":{"path":"","size":0},"training":{"adapter":"cap-think-meta-comments","final_loss":0.664,"elapsed_s":84},"asi":{},"notes":""}
{"iter":60,"slug":"tmc-s99","ts":"2026-05-16T03:56:08Z","status":"discard","score":0.8262,"n":75,"delta":-0.0604,"hypothesis":"","dataset":{"path":"","size":0},"training":{"adapter":"cap-tmc-s99","final_loss":1.225,"elapsed_s":82},"asi":{},"notes":""}
{"iter":61,"slug":"sft-grpo-ties","ts":"2026-05-16T03:57:47Z","status":"discard","score":0.7814,"n":75,"delta":-0.1052,"hypothesis":"","dataset":{"path":"","size":0},"training":{"adapter":"cap-sft-grpo-ties","final_loss":0,"elapsed_s":0},"asi":{},"notes":""}
{"iter":62,"slug":"think-shuffle-lr1e7","ts":"2026-05-16T04:00:52Z","status":"discard","score":0.6699,"n":75,"delta":-0.2167,"hypothesis":"","dataset":{"path":"","size":0},"training":{"adapter":"cap-think-shuffle-1e7","final_loss":1.321,"elapsed_s":94},"asi":{},"notes":""}
{"iter":63,"slug":"think-shuffle-lr1e6","ts":"2026-05-16T04:03:09Z","status":"discard","score":0.6699,"n":75,"delta":-0.2167,"hypothesis":"","dataset":{"path":"","size":0},"training":{"adapter":"cap-think-shuffle","final_loss":1.314,"elapsed_s":97},"asi":{},"notes":""}
{"iter":64,"slug":"recovery-s99","ts":"2026-05-16T04:38:10Z","status":"kept","score":0.8541,"n":75,"delta":-0.0325,"hypothesis":"","dataset":{"path":"","size":0},"training":{"adapter":"cap-recovery-s99","final_loss":1.246,"elapsed_s":91},"asi":{},"notes":""}
{"iter":65,"slug":"rec-s7","ts":"2026-05-16T05:04:14Z","status":"discard","score":0.8487,"n":75,"delta":-0.0379,"hypothesis":"","dataset":{"path":"","size":0},"training":{"adapter":"cap-rec-s7","final_loss":0,"elapsed_s":0},"asi":{},"notes":""}
{"iter":66,"slug":"rec-s42","ts":"2026-05-16T05:04:14Z","status":"discard","score":0.8460,"n":75,"delta":-0.0406,"hypothesis":"","dataset":{"path":"","size":0},"training":{"adapter":"cap-rec-s42","final_loss":0,"elapsed_s":0},"asi":{},"notes":""}
{"iter":67,"slug":"rec-s89","ts":"2026-05-16T05:04:14Z","status":"discard","score":0.8599,"n":75,"delta":-0.0267,"hypothesis":"","dataset":{"path":"","size":0},"training":{"adapter":"cap-rec-s89","final_loss":0,"elapsed_s":0},"asi":{},"notes":""}
{"iter":68,"slug":"rec-s137","ts":"2026-05-16T05:04:14Z","status":"discard","score":0.8613,"n":75,"delta":-0.0253,"hypothesis":"","dataset":{"path":"","size":0},"training":{"adapter":"cap-rec-s137","final_loss":0,"elapsed_s":0},"asi":{},"notes":""}
{"iter":69,"slug":"rec-s211","ts":"2026-05-16T05:04:14Z","status":"discard","score":0.8411,"n":75,"delta":-0.0455,"hypothesis":"","dataset":{"path":"","size":0},"training":{"adapter":"cap-rec-s211","final_loss":0,"elapsed_s":0},"asi":{},"notes":""}
{"iter":70,"slug":"rec-s311","ts":"2026-05-16T05:04:14Z","status":"discard","score":0.8240,"n":75,"delta":-0.0626,"hypothesis":"","dataset":{"path":"","size":0},"training":{"adapter":"cap-rec-s311","final_loss":0,"elapsed_s":0},"asi":{},"notes":""}
{"iter":71,"slug":"rec-s503","ts":"2026-05-16T05:04:14Z","status":"discard","score":0.8558,"n":75,"delta":-0.0308,"hypothesis":"","dataset":{"path":"","size":0},"training":{"adapter":"cap-rec-s503","final_loss":0,"elapsed_s":0},"asi":{},"notes":""}
{"iter":72,"slug":"rec-s701","ts":"2026-05-16T05:04:14Z","status":"discard","score":0.8610,"n":75,"delta":-0.0256,"hypothesis":"","dataset":{"path":"","size":0},"training":{"adapter":"cap-rec-s701","final_loss":0,"elapsed_s":0},"asi":{},"notes":""}
{"iter":73,"slug":"rec-s911","ts":"2026-05-16T05:04:14Z","status":"discard","score":0.8359,"n":75,"delta":-0.0507,"hypothesis":"","dataset":{"path":"","size":0},"training":{"adapter":"cap-rec-s911","final_loss":0,"elapsed_s":0},"asi":{},"notes":""}
{"iter":74,"slug":"self-distill-mbpp","ts":"2026-05-16T05:07:16Z","status":"kept","score":0.8348,"n":75,"delta":-0.0518,"hypothesis":"","dataset":{"path":"","size":0},"training":{"adapter":"cap-self-distill-mbpp","final_loss":0.369,"elapsed_s":103},"asi":{},"notes":""}
{"iter":75,"slug":"think-augmented","ts":"2026-05-16T05:11:12Z","status":"discard","score":0.8354,"n":75,"delta":-0.0512,"hypothesis":"","dataset":{"path":"","size":0},"training":{"adapter":"cap-think-augmented","final_loss":1.159,"elapsed_s":130},"asi":{},"notes":""}
{"iter":76,"slug":"rec-s137-r16","ts":"2026-05-16T05:14:52Z","status":"discard","score":0.7287,"n":75,"delta":-0.1579,"hypothesis":"","dataset":{"path":"","size":0},"training":{"adapter":"cap-rec-s137-r16","final_loss":0.781,"elapsed_s":90},"asi":{},"notes":""}
{"iter":77,"slug":"stacked-rec-hu","ts":"2026-05-16T05:16:23Z","status":"crash","score":null,"n":75,"delta":0,"hypothesis":"","dataset":{"path":"","size":0},"training":{"adapter":"cap-stacked-rec-hu","final_loss":0,"elapsed_s":0},"asi":{},"notes":""}
{"iter":78,"slug":"stacked2","ts":"2026-05-16T05:28:18Z","status":"kept","score":0.8653,"n":75,"delta":-0.0213,"hypothesis":"","dataset":{"path":"","size":0},"training":{"adapter":"cap-stacked2","final_loss":0.054,"elapsed_s":0},"asi":{},"notes":""}
{"iter":79,"slug":"stacked3","ts":"2026-05-16T05:34:26Z","status":"discard","score":0.8062,"n":75,"delta":-0.0804,"hypothesis":"","dataset":{"path":"","size":0},"training":{"adapter":"cap-stacked3","final_loss":0,"elapsed_s":0},"asi":{},"notes":""}
{"iter":80,"slug":"stacked-think","ts":"2026-05-16T05:40:10Z","status":"kept","score":0.8670,"n":75,"delta":-0.0196,"hypothesis":"","dataset":{"path":"","size":0},"training":{"adapter":"cap-stacked-think","final_loss":0,"elapsed_s":0},"asi":{},"notes":""}
{"iter":81,"slug":"stack-trip","ts":"2026-05-16T05:44:03Z","status":"crash","score":null,"n":75,"delta":0,"hypothesis":"","dataset":{"path":"","size":0},"training":{"adapter":"cap-stack-trip","final_loss":0,"elapsed_s":0},"asi":{},"notes":""}
{"iter":82,"slug":"rec137-base","ts":"2026-05-16T05:47:41Z","status":"kept","score":0.8406,"n":75,"delta":-0.046,"hypothesis":"","dataset":{"path":"","size":0},"training":{"adapter":"cap-rec137-base","final_loss":0.778,"elapsed_s":91},"asi":{},"notes":""}
{"iter":83,"slug":"rec137-stacked","ts":"2026-05-16T05:53:37Z","status":"kept","score":0.8624,"n":75,"delta":-0.0242,"hypothesis":"","dataset":{"path":"","size":0},"training":{"adapter":"cap-rec137-stacked","final_loss":0,"elapsed_s":0},"asi":{},"notes":""}
{"iter":84,"slug":"rec137-triple","ts":"2026-05-16T05:57:23Z","status":"crash","score":null,"n":75,"delta":0,"hypothesis":"","dataset":{"path":"","size":0},"training":{"adapter":"","final_loss":0,"elapsed_s":0},"asi":{},"notes":""}
{"iter":85,"slug":"rec137-trip3","ts":"2026-05-16T06:04:23Z","status":"discard","score":0.8387,"n":75,"delta":-0.0479,"hypothesis":"","dataset":{"path":"","size":0},"training":{"adapter":"cap-rec137-trip3","final_loss":0,"elapsed_s":0},"asi":{},"notes":""}
{"iter":86,"slug":"big-s1009","ts":"2026-05-16T06:23:16Z","status":"discard","score":0.8646,"n":75,"delta":-0.022,"hypothesis":"","dataset":{"path":"","size":0},"training":{"adapter":"cap-big-s1009","final_loss":0,"elapsed_s":0},"asi":{},"notes":""}
{"iter":87,"slug":"big-s1013","ts":"2026-05-16T06:23:16Z","status":"discard","score":0.8339,"n":75,"delta":-0.0527,"hypothesis":"","dataset":{"path":"","size":0},"training":{"adapter":"cap-big-s1013","final_loss":0,"elapsed_s":0},"asi":{},"notes":""}
{"iter":88,"slug":"big-s1019","ts":"2026-05-16T06:23:16Z","status":"discard","score":0.8622,"n":75,"delta":-0.0244,"hypothesis":"","dataset":{"path":"","size":0},"training":{"adapter":"cap-big-s1019","final_loss":0,"elapsed_s":0},"asi":{},"notes":""}
{"iter":89,"slug":"big-s1021","ts":"2026-05-16T06:23:16Z","status":"discard","score":0.8500,"n":75,"delta":-0.0366,"hypothesis":"","dataset":{"path":"","size":0},"training":{"adapter":"cap-big-s1021","final_loss":0,"elapsed_s":0},"asi":{},"notes":""}
{"iter":90,"slug":"big-s1031","ts":"2026-05-16T06:23:16Z","status":"discard","score":0.8243,"n":75,"delta":-0.0623,"hypothesis":"","dataset":{"path":"","size":0},"training":{"adapter":"cap-big-s1031","final_loss":0,"elapsed_s":0},"asi":{},"notes":""}
{"iter":91,"slug":"big-s1033","ts":"2026-05-16T06:23:16Z","status":"discard","score":0.8430,"n":75,"delta":-0.0436,"hypothesis":"","dataset":{"path":"","size":0},"training":{"adapter":"cap-big-s1033","final_loss":0,"elapsed_s":0},"asi":{},"notes":""}
{"iter":92,"slug":"s1009-stack","ts":"2026-05-16T06:29:38Z","status":"discard","score":0.8581,"n":75,"delta":-0.0285,"hypothesis":"","dataset":{"path":"","size":0},"training":{"adapter":"cap-s1009-stack","final_loss":0,"elapsed_s":0},"asi":{},"notes":""}
{"iter":93,"slug":"best-of-k-short","ts":"2026-05-16T06:36:35Z","status":"discard","score":0.8362,"n":75,"delta":-0.0504,"hypothesis":"","dataset":{"path":"","size":0},"training":{"adapter":"cap-best-of-k-short","final_loss":0.047,"elapsed_s":127},"asi":{},"notes":""}
{"iter":94,"slug":"quad-stack","ts":"2026-05-16T06:43:09Z","status":"discard","score":0.8468,"n":75,"delta":-0.0398,"hypothesis":"","dataset":{"path":"","size":0},"training":{"adapter":"cap-quad-stack","final_loss":0,"elapsed_s":0},"asi":{},"notes":""}
{"iter":95,"slug":"sa-thinking-60","ts":"2026-05-16T06:58:43Z","status":"discard","score":0.8561,"n":75,"delta":-0.0305,"hypothesis":"","dataset":{"path":"","size":0},"training":{"adapter":"cap-sa-thinking-60","final_loss":0.823,"elapsed_s":166},"asi":{},"notes":""}
{"iter":96,"slug":"tm-s42","ts":"2026-05-16T07:14:59Z","status":"discard","score":0.8366,"n":75,"delta":-0.05,"hypothesis":"","dataset":{"path":"","size":0},"training":{"adapter":"cap-tm-s42","final_loss":0,"elapsed_s":0},"asi":{},"notes":""}
{"iter":97,"slug":"tm-s99","ts":"2026-05-16T07:14:59Z","status":"discard","score":0.8466,"n":75,"delta":-0.04,"hypothesis":"","dataset":{"path":"","size":0},"training":{"adapter":"cap-tm-s99","final_loss":0,"elapsed_s":0},"asi":{},"notes":""}
{"iter":98,"slug":"tm-s137","ts":"2026-05-16T07:14:59Z","status":"discard","score":0.8396,"n":75,"delta":-0.047,"hypothesis":"","dataset":{"path":"","size":0},"training":{"adapter":"cap-tm-s137","final_loss":0,"elapsed_s":0},"asi":{},"notes":""}
{"iter":99,"slug":"deep-stack","ts":"2026-05-16T07:21:27Z","status":"discard","score":0.8462,"n":75,"delta":-0.0404,"hypothesis":"","dataset":{"path":"","size":0},"training":{"adapter":"cap-deep-stack","final_loss":0,"elapsed_s":0},"asi":{},"notes":""}
{"iter":100,"slug":"recovery-s99-rerun","ts":"2026-05-16T07:24:48Z","status":"discard","score":0.8475,"n":75,"delta":-0.0391,"hypothesis":"","dataset":{"path":"","size":0},"training":{"adapter":"cap-recovery-s99","final_loss":1.252,"elapsed_s":94},"asi":{},"notes":""}
{"iter":101,"slug":"double-99","ts":"2026-05-16T07:30:46Z","status":"discard","score":0.8431,"n":75,"delta":-0.0435,"hypothesis":"","dataset":{"path":"","size":0},"training":{"adapter":"cap-double-99","final_loss":0,"elapsed_s":0},"asi":{},"notes":""}
{"iter":102,"slug":"think-sgd","ts":"2026-05-16T07:38:42Z","status":"kept","score":0.8694,"n":75,"delta":-0.0172,"hypothesis":"","dataset":{"path":"","size":0},"training":{"adapter":"cap-think-sgd","final_loss":0,"elapsed_s":0},"asi":{},"notes":""}
{"iter":103,"slug":"sgd-lr-1e-4","ts":"2026-05-16T08:09:29Z","status":"discard","score":0.8460,"n":75,"delta":-0.0406,"hypothesis":"","dataset":{"path":"","size":0},"training":{"adapter":"cap-sgd-1e-4","final_loss":0,"elapsed_s":0},"asi":{},"notes":""}
{"iter":104,"slug":"sgd-lr-2e-5","ts":"2026-05-16T08:09:29Z","status":"discard","score":0.8068,"n":75,"delta":-0.0798,"hypothesis":"","dataset":{"path":"","size":0},"training":{"adapter":"cap-sgd-2e-5","final_loss":0,"elapsed_s":0},"asi":{},"notes":""}
{"iter":105,"slug":"sgd-lr-1e-5","ts":"2026-05-16T08:09:29Z","status":"discard","score":0.7556,"n":75,"delta":-0.131,"hypothesis":"","dataset":{"path":"","size":0},"training":{"adapter":"cap-sgd-1e-5","final_loss":0,"elapsed_s":0},"asi":{},"notes":""}
{"iter":106,"slug":"sgd-lr-1e-3","ts":"2026-05-16T08:09:29Z","status":"discard","score":0,"n":75,"delta":-0.8866,"hypothesis":"","dataset":{"path":"","size":0},"training":{"adapter":"cap-sgd-1e-3","final_loss":0,"elapsed_s":0},"asi":{},"notes":""}
{"iter":107,"slug":"sgd-stack2","ts":"2026-05-16T08:19:46Z","status":"discard","score":0.8531,"n":75,"delta":-0.0335,"hypothesis":"","dataset":{"path":"","size":0},"training":{"adapter":"cap-sgd-stack2","final_loss":0,"elapsed_s":0},"asi":{},"notes":""}
{"iter":108,"slug":"sgd-stacked","ts":"2026-05-16T08:19:46Z","status":"crash","score":null,"n":75,"delta":0,"hypothesis":"","dataset":{"path":"","size":0},"training":{"adapter":"","final_loss":0,"elapsed_s":0},"asi":{},"notes":""}
{"iter":109,"slug":"sgd-a8","ts":"2026-05-16T08:52:52Z","status":"discard","score":0.8489,"n":75,"delta":-0.0377,"hypothesis":"","dataset":{"path":"","size":0},"training":{"adapter":"cap-sgd-a8","final_loss":0,"elapsed_s":0},"asi":{},"notes":""}
{"iter":110,"slug":"sgd-a16","ts":"2026-05-16T08:52:52Z","status":"discard","score":0.8535,"n":75,"delta":-0.0331,"hypothesis":"","dataset":{"path":"","size":0},"training":{"adapter":"cap-sgd-a16","final_loss":0,"elapsed_s":0},"asi":{},"notes":""}
{"iter":111,"slug":"sgd-a64","ts":"2026-05-16T08:52:52Z","status":"discard","score":0.8463,"n":75,"delta":-0.0403,"hypothesis":"","dataset":{"path":"","size":0},"training":{"adapter":"cap-sgd-a64","final_loss":0,"elapsed_s":0},"asi":{},"notes":""}
{"iter":112,"slug":"sgd-a128","ts":"2026-05-16T08:52:52Z","status":"discard","score":0.7560,"n":75,"delta":-0.1306,"hypothesis":"","dataset":{"path":"","size":0},"training":{"adapter":"cap-sgd-a128","final_loss":0,"elapsed_s":0},"asi":{},"notes":""}
{"iter":113,"slug":"predict-output","ts":"2026-05-16T08:56:11Z","status":"discard","score":0.8487,"n":75,"delta":-0.0379,"hypothesis":"","dataset":{"path":"","size":0},"training":{"adapter":"cap-predict-output","final_loss":0.196,"elapsed_s":75},"asi":{},"notes":""}
{"iter":114,"slug":"predict-sgd","ts":"2026-05-16T09:00:56Z","status":"kept","score":0.8776,"n":75,"delta":-0.009,"hypothesis":"","dataset":{"path":"","size":0},"training":{"adapter":"cap-predict-sgd","final_loss":0,"elapsed_s":0},"asi":{},"notes":""}
{"iter":115,"slug":"po-s99","ts":"2026-05-16T09:21:28Z","status":"discard","score":0.8047,"n":75,"delta":-0.0819,"hypothesis":"","dataset":{"path":"","size":0},"training":{"adapter":"cap-po-s99","final_loss":0,"elapsed_s":0},"asi":{},"notes":""}
{"iter":116,"slug":"po-s42","ts":"2026-05-16T09:21:28Z","status":"discard","score":0.8200,"n":75,"delta":-0.0666,"hypothesis":"","dataset":{"path":"","size":0},"training":{"adapter":"cap-po-s42","final_loss":0,"elapsed_s":0},"asi":{},"notes":""}
{"iter":117,"slug":"po-s137","ts":"2026-05-16T09:21:28Z","status":"discard","score":0.8194,"n":75,"delta":-0.0672,"hypothesis":"","dataset":{"path":"","size":0},"training":{"adapter":"cap-po-s137","final_loss":0,"elapsed_s":0},"asi":{},"notes":""}
{"iter":118,"slug":"think-po-stack","ts":"2026-05-16T09:25:58Z","status":"discard","score":0.8362,"n":75,"delta":-0.0504,"hypothesis":"","dataset":{"path":"","size":0},"training":{"adapter":"cap-think-po-stack","final_loss":0,"elapsed_s":0},"asi":{},"notes":""}
{"iter":119,"slug":"po-64","ts":"2026-05-16T09:34:23Z","status":"discard","score":0.1908,"n":75,"delta":-0.6958,"hypothesis":"","dataset":{"path":"","size":0},"training":{"adapter":"cap-po-64","final_loss":0,"elapsed_s":0},"asi":{},"notes":""}
{"iter":120,"slug":"po-s1","ts":"2026-05-16T09:38:59Z","status":"discard","score":0.7438,"n":75,"delta":-0.1428,"hypothesis":"","dataset":{"path":"","size":0},"training":{"adapter":"cap-po-s1","final_loss":0,"elapsed_s":0},"asi":{},"notes":""}
{"iter":121,"slug":"po-redo","ts":"2026-05-16T09:44:18Z","status":"discard","score":0.6991,"n":75,"delta":-0.1875,"hypothesis":"","dataset":{"path":"","size":0},"training":{"adapter":"cap-po-redo","final_loss":0,"elapsed_s":0},"asi":{},"notes":""}
{"iter":122,"slug":"po-seed1","ts":"2026-05-16T10:06:48Z","status":"discard","score":0.8047,"n":75,"delta":-0.0819,"hypothesis":"","dataset":{"path":"","size":0},"training":{"adapter":"cap-po-seed1","final_loss":0,"elapsed_s":0},"asi":{},"notes":""}
{"iter":123,"slug":"po-seed7","ts":"2026-05-16T10:06:48Z","status":"discard","score":0.8301,"n":75,"delta":-0.0565,"hypothesis":"","dataset":{"path":"","size":0},"training":{"adapter":"cap-po-seed7","final_loss":0,"elapsed_s":0},"asi":{},"notes":""}
{"iter":124,"slug":"po-seed42","ts":"2026-05-16T10:06:48Z","status":"discard","score":0.8062,"n":75,"delta":-0.0804,"hypothesis":"","dataset":{"path":"","size":0},"training":{"adapter":"cap-po-seed42","final_loss":0,"elapsed_s":0},"asi":{},"notes":""}
{"iter":125,"slug":"po-seed99","ts":"2026-05-16T10:06:48Z","status":"discard","score":0.7853,"n":75,"delta":-0.1013,"hypothesis":"","dataset":{"path":"","size":0},"training":{"adapter":"cap-po-seed99","final_loss":0,"elapsed_s":0},"asi":{},"notes":""}
{"iter":126,"slug":"po-seed137","ts":"2026-05-16T10:06:48Z","status":"discard","score":0.7506,"n":75,"delta":-0.136,"hypothesis":"","dataset":{"path":"","size":0},"training":{"adapter":"cap-po-seed137","final_loss":0,"elapsed_s":0},"asi":{},"notes":""}
{"iter":127,"slug":"code-explain","ts":"2026-05-16T10:13:36Z","status":"discard","score":0.7768,"n":75,"delta":-0.1098,"hypothesis":"","dataset":{"path":"","size":0},"training":{"adapter":"cap-code-explain","final_loss":0,"elapsed_s":0},"asi":{},"notes":""}
{"iter":128,"slug":"po-mega-sgd-5e5","ts":"2026-05-16T10:24:25Z","status":"discard","score":0.1383,"n":75,"delta":-0.7483,"hypothesis":"","dataset":{"path":"","size":0},"training":{"adapter":"cap-po-mega","final_loss":0,"elapsed_s":0},"asi":{},"notes":""}
