{"iter":129,"slug":"po-mega-sgd-1e5","ts":"2026-05-16T10:31:22Z","status":"discard","score":0.8334,"n":75,"delta":-0.0532,"hypothesis":"","dataset":{"path":"","size":0},"training":{"adapter":"cap-po-mega-l5","final_loss":0,"elapsed_s":0},"asi":{},"notes":""}
{"iter":130,"slug":"po-mega-adam","ts":"2026-05-16T10:38:52Z","status":"discard","score":0.7426,"n":75,"delta":-0.144,"hypothesis":"","dataset":{"path":"","size":0},"training":{"adapter":"cap-po-mega-adam","final_loss":0,"elapsed_s":0},"asi":{},"notes":""}
{"iter":131,"slug":"math-cross","ts":"2026-05-16T10:45:39Z","status":"discard","score":0.7863,"n":75,"delta":-0.1003,"hypothesis":"","dataset":{"path":"","size":0},"training":{"adapter":"cap-math-cross","final_loss":0,"elapsed_s":0},"asi":{},"notes":""}
{"iter":132,"slug":"codealpaca","ts":"2026-05-16T10:53:13Z","status":"discard","score":0.8008,"n":75,"delta":-0.0858,"hypothesis":"","dataset":{"path":"","size":0},"training":{"adapter":"cap-codealpaca","final_loss":0,"elapsed_s":0},"asi":{},"notes":""}
{"iter":133,"slug":"tiny-idioms","ts":"2026-05-16T10:58:55Z","status":"discard","score":0.8265,"n":75,"delta":-0.0601,"hypothesis":"","dataset":{"path":"","size":0},"training":{"adapter":"cap-tiny-idioms","final_loss":0,"elapsed_s":0},"asi":{},"notes":""}
{"iter":134,"slug":"idiom-think","ts":"2026-05-16T11:05:18Z","status":"discard","score":0.7968,"n":75,"delta":-0.0898,"hypothesis":"","dataset":{"path":"","size":0},"training":{"adapter":"cap-idiom-think","final_loss":0,"elapsed_s":0},"asi":{},"notes":""}
{"iter":135,"slug":"edge-first","ts":"2026-05-16T11:11:08Z","status":"discard","score":0.7092,"n":75,"delta":-0.1774,"hypothesis":"","dataset":{"path":"","size":0},"training":{"adapter":"cap-edge-first","final_loss":0,"elapsed_s":0},"asi":{},"notes":""}
{"iter":136,"slug":"primitives-mix","ts":"2026-05-16T00:00:00Z","status":"discarded","score":0.6877,"delta":-0.18,"n":75,"hypothesis":"64-ex mix of dyna/inducto/logic/filtro primitives transfers to code via shared underlying ops.","dataset":{"path":"datasets/primitives-mix.jsonl","size":64,"construction":"16 each from ericflo/{dyna,inducto,logic,filtro}-50M at difficulty<=2","modality":"symbolic","source":"hf-ericflo"},"training":{"adapter":"cap-primitives-mix","lr":1e-4,"epochs":1,"lora_rank":4,"final_loss":0.37,"elapsed_s":169},"asi":{"what_worked":null,"what_failed":"symbolic-only supervision steered model toward terse non-code completions, hurting code form","next_focus":"wrap the primitives in prose Q&A — same skill, narrative supervision"},"notes":"the math-broad analog needs prose meta layer, not just symbolic primitives"}
{"iter":137,"slug":"decomp-prose","ts":"2026-05-16T00:00:00Z","status":"discarded","score":0.6533,"delta":-0.21,"n":75,"hypothesis":"32 algorithm-decomposition prose + 32 short Python anchors mirrors math-broad's winning recipe.","dataset":{"path":"datasets/decomp-prose-anchors.jsonl","size":64,"construction":"32 prose (100-200 word) algo explanations + 32 short Python solutions","modality":"prose+code","source":"hand-written"},"training":{"adapter":"cap-decomp-prose","lr":1e-4,"epochs":1,"lora_rank":4,"final_loss":0.085,"elapsed_s":280},"asi":{"what_worked":null,"what_failed":"long prose answers steer model toward verbosity, hurts code output","next_focus":"keep prose short or invert ratio: more code anchors, less prose"},"notes":"prose was too long; ratio inverted from math-broad's"}
{"iter":138,"slug":"multi-turn-debug","ts":"2026-05-16T00:00:00Z","status":"discarded","score":0.7845,"delta":-0.085,"n":75,"hypothesis":"Multi-turn debug dialogues with code as final turn preserve code form while teaching debug reasoning.","dataset":{"path":"datasets/multi-turn-debug.jsonl","size":32,"construction":"32 multi-turn dialogues: broken code -> explanation -> request -> clean Python","modality":"multi-turn dialogue","source":"hand-written"},"training":{"adapter":"cap-multi-turn-debug","lr":1e-4,"epochs":1,"lora_rank":4,"final_loss":0.96,"elapsed_s":76},"asi":{"what_worked":"closer to baseline than primitives/prose","what_failed":"multi-turn structure conflicts with single-turn eval","next_focus":"keep single-turn structure; weird-domain question -> Python code answer"},"notes":"all multi-turn examples teach multi-turn habit"}
{"iter":139,"slug":"cross-domain-py","ts":"2026-05-16T00:00:00Z","status":"discarded","score":0.6973,"delta":-0.17,"n":75,"hypothesis":"63 weird-domain inputs with Python code outputs preserves form while introducing fresh supervision.","dataset":{"path":"datasets/cross-domain-py.jsonl","size":63,"construction":"63 hand-written: state-tracking, rule-induction, logic, business, word-games with print() style Python","modality":"code+narrative","source":"hand-written"},"training":{"adapter":"cap-cross-domain-py","lr":1e-4,"epochs":1,"lora_rank":4,"final_loss":0.17,"elapsed_s":~270},"asi":{"what_worked":null,"what_failed":"print() style clashes with eval's def-return form","next_focus":"re-cast all answers in def...return form"},"notes":"surface form (print vs def-return) matters more than domain"}
{"iter":140,"slug":"cross-defs","ts":"2026-05-16T00:00:00Z","status":"discarded","score":0.7219,"delta":-0.15,"n":75,"hypothesis":"Same weird domains but all in def-return form preserves eval form while shifting content.","dataset":{"path":"datasets/cross-domain-defs.jsonl","size":64,"construction":"64 def-form Python: state-tracking, rule-induction, logic, business, word-games","modality":"code","source":"hand-written"},"training":{"adapter":"cap-cross-defs","lr":1e-4,"epochs":1,"lora_rank":4,"final_loss":0.11,"elapsed_s":~270},"asi":{"what_worked":null,"what_failed":"still too varied; weird user prompts steer model away from canonical answers","next_focus":"add thinking comments inside def to mimic winning shape"},"notes":"def form helps but content variation still hurts"}
{"iter":141,"slug":"cross-defs-think","ts":"2026-05-16T00:00:00Z","status":"discarded","score":0.6378,"delta":-0.23,"n":75,"hypothesis":"Cross-domain + thinking comments inside def mimics winning shape but with new content.","dataset":{"path":"datasets/cross-defs-think.jsonl","size":64,"construction":"cross-defs with 1-2 strategy comments injected after def line","modality":"code","source":"hand-written+inject"},"training":{"adapter":"cap-cross-defs-think","lr":1e-4,"epochs":1,"lora_rank":4,"final_loss":~0.08,"elapsed_s":~280},"asi":{"what_worked":null,"what_failed":"comments do not save cross-domain content","next_focus":"mix proven winner with cross-domain as 50/50"},"notes":"shape and content interact; can't divorce"}
{"iter":142,"slug":"winning-plus-cross","ts":"2026-05-16T00:00:00Z","status":"discarded","score":0.5859,"delta":-0.28,"n":75,"hypothesis":"50/50 mix of proven winning shape + cross-defs-think should net positive.","dataset":{"path":"datasets/winning-plus-cross32.jsonl","size":64,"construction":"32 from code-with-thinking-comments-v2 + 32 from cross-defs-think","modality":"code","source":"mixed"},"training":{"adapter":"cap-winning-plus-cross","lr":1e-4,"epochs":1,"lora_rank":4,"final_loss":~0.36,"elapsed_s":~280},"asi":{"what_worked":null,"what_failed":"mixing cross-domain hurts even at 50/50","next_focus":"narrow content (word games) in exact winning shape"},"notes":"cross-domain actively hurts; below baseline (0.80) at 0.59"}
{"iter":145,"slug":"merge-think-predict","ts":"2026-05-16T00:00:00Z","status":"discarded","score":0.7558,"delta":-0.12,"n":75,"hypothesis":"Weighted-avg merge of two best adapters composes complementary lifts.","dataset":{"path":"n/a","size":0,"construction":"merge of cap-think-sgd + cap-predict-sgd, 0.5/0.5","modality":"merge","source":"merge"},"training":{"adapter":"cap-merge-think-predict","lr":null,"epochs":0,"lora_rank":4,"final_loss":null,"elapsed_s":2},"asi":{"what_worked":null,"what_failed":"averaging dilutes both signals","next_focus":"none — content-shift ceiling appears structural"},"notes":"merge regressed below both sources"}
{"iter":149,"slug":"state-trace","ts":"2026-05-16T00:00:00Z","status":"discarded","score":0.6909,"delta":-0.12,"n":75,"hypothesis":"Code with inline # state: var=val annotations teaches execution tracking.","dataset":{"path":"datasets/state-trace.jsonl","size":32,"construction":"32 hand-written: code with # state: comments per line","modality":"code","source":"hand-written"},"training":{"adapter":"cap-state-trace","lr":1e-4,"epochs":1,"lora_rank":4,"final_loss":null,"elapsed_s":~150},"asi":{"what_worked":null,"what_failed":"state annotations are dense and shift distribution","next_focus":"variance hunt on winning recipe across new seeds"},"notes":"another aug; same regression pattern"}
{"iter":150,"slug":"win-s7","ts":"2026-05-16T00:00:00Z","status":"discarded","score":0.7523,"delta":-0.12,"n":75,"hypothesis":"Re-run winning recipe at seed 7, lr 1e-4.","dataset":{"path":"datasets/winning-s7.jsonl","size":32,"construction":"shuffle of code-with-thinking-comments-v2","modality":"code","source":"shuffle"},"training":{"adapter":"cap-win-s7","lr":1e-4,"epochs":1,"lora_rank":4,"final_loss":null,"elapsed_s":~120},"asi":{"what_worked":null,"what_failed":"lr 1e-4 too aggressive","next_focus":"low lr 5e-6"},"notes":"variance hunt with default lr regresses"}
{"iter":151,"slug":"win-s7-low","ts":"2026-05-16T00:00:00Z","status":"discarded","score":0.8308,"delta":-0.04,"n":75,"hypothesis":"Same recipe, seed 7, lr 5e-6 - more gentle.","dataset":{"path":"datasets/winning-s7.jsonl","size":32,"construction":"shuffle","modality":"code","source":"shuffle"},"training":{"adapter":"cap-win-s7-low","lr":5e-6,"epochs":1,"lora_rank":4,"final_loss":0.76,"elapsed_s":~120},"asi":{"what_worked":"low lr much better than 1e-4","what_failed":"still 0.83, below 0.87 ceiling","next_focus":"sweep more seeds at lr 5e-6"},"notes":"low lr is the right zone"}
{"iter":152,"slug":"win-s42-low","ts":"2026-05-16T00:00:00Z","status":"discarded","score":0.8466,"delta":-0.02,"n":75,"hypothesis":"Seed 42, lr 5e-6.","dataset":{"path":"datasets/winning-s42.jsonl","size":32,"construction":"shuffle s42","modality":"code","source":"shuffle"},"training":{"adapter":"cap-win-s42-low","lr":5e-6,"epochs":1,"lora_rank":4,"final_loss":null,"elapsed_s":~120},"asi":{"what_worked":"close to ceiling","what_failed":"didn't beat 0.87","next_focus":"try sgd; try more seeds"},"notes":"reasonable but no breakthrough"}
{"iter":153,"slug":"win-s42-sgd","ts":"2026-05-16T00:00:00Z","status":"discarded","score":0.6325,"delta":-0.24,"n":75,"hypothesis":"SGD lr 5e-5 + 1 epoch on s42 shuffle.","dataset":{"path":"datasets/winning-s42.jsonl","size":32,"construction":"shuffle s42","modality":"code","source":"shuffle"},"training":{"adapter":"sft-f558187c","lr":5e-5,"epochs":1,"lora_rank":4,"final_loss":null,"elapsed_s":~120},"asi":{"what_worked":null,"what_failed":"1 epoch SGD too undertrained","next_focus":"3 epochs SGD like iter 102"},"notes":"undertrained"}
{"iter":154,"slug":"win-s42-sgd3","ts":"2026-05-16T00:00:00Z","status":"discarded","score":0.6832,"delta":-0.19,"n":75,"hypothesis":"3 epochs SGD lr 5e-5 on s42.","dataset":{"path":"datasets/winning-s42.jsonl","size":32,"construction":"shuffle","modality":"code","source":"shuffle"},"training":{"adapter":"sft-c3829676","lr":5e-5,"epochs":3,"lora_rank":4,"final_loss":null,"elapsed_s":~300},"asi":{"what_worked":null,"what_failed":"3ep on s42 doesn't reproduce 0.87","next_focus":"try exact iter 102 data"},"notes":"high SGD variance"}
{"iter":155,"slug":"think-sgd-redo","ts":"2026-05-16T00:00:00Z","status":"discarded","score":0.8492,"delta":-0.02,"n":75,"hypothesis":"Exact iter 102 recipe and data replayed.","dataset":{"path":"datasets/think-sgd-exact.jsonl","size":32,"construction":"extracted from cap-think-sgd replay","modality":"code","source":"replay"},"training":{"adapter":"cap-think-sgd-redo","lr":5e-5,"epochs":3,"lora_rank":4,"final_loss":null,"elapsed_s":~300},"asi":{"what_worked":"closer to ceiling","what_failed":"didn't reproduce 0.87","next_focus":"5 more seed runs to find lucky tail"},"notes":"iter 102's 0.87 was lucky"}
{"iter":159,"slug":"cap-stack-best","ts":"2026-05-16T00:00:00Z","status":"kept","score":0.8595,"delta":+0.002,"n":75,"hypothesis":"Stack winning-64 on top of cap-sgd-run2 (best so far at 0.8574) with very gentle lr 3e-6 for 1 epoch.","dataset":{"path":"datasets/winning-64.jsonl","size":64,"construction":"think-sgd-exact + winning-expanded","modality":"code","source":"combined"},"training":{"adapter":"cap-stack-best","lr":3e-6,"epochs":1,"lora_rank":4,"final_loss":null,"elapsed_s":~400},"asi":{"what_worked":"tiny positive lift from stacking","what_failed":"only +0.002","next_focus":"more stacks; stack imt-v2; GRPO"},"notes":"stack-best > base layer by 0.002"}
{"iter":160,"slug":"cap-stack-imt2","ts":"2026-05-16T00:00:00Z","status":"kept","score":0.8702,"delta":+0.011,"n":75,"hypothesis":"Stack imt-tiny (11 short multi-turn dialogs from user's IMT idea) on top of cap-stack-best at lr 1e-6.","dataset":{"path":"datasets/imt-tiny.jsonl","size":11,"construction":"imt-dialogs-v2 filtered <1500 bytes","modality":"multi-turn code","source":"generated"},"training":{"adapter":"cap-stack-imt2","lr":1e-6,"epochs":1,"lora_rank":4,"final_loss":null,"elapsed_s":~120},"asi":{"what_worked":"USER'S IDEA WORKED - IMT multi-turn dialogs as gentle stack layer lifted +0.011","what_failed":null,"next_focus":"more stack layers; bigger IMT dataset"},"notes":"BEST SCORE TO DATE - 0.8702 stable"}
{"iter":161,"slug":"cap-stack-l3","ts":"2026-05-16T00:00:00Z","status":"discarded","score":0.8461,"delta":-0.024,"n":75}
{"iter":162,"slug":"cap-sgd2-imt","ts":"2026-05-16T00:00:00Z","status":"discarded","score":0.8519,"delta":-0.018,"n":75}
{"iter":163,"slug":"cap-stack-imt-med","ts":"2026-05-16T00:00:00Z","status":"crash","score":null,"delta":null,"n":75,"notes":"21 ex OOM"}
{"iter":164,"slug":"cap-stack-imt16","ts":"2026-05-16T00:00:00Z","status":"discarded","score":0.8530,"delta":-0.017,"n":75,"notes":"16 ex IMT stack regressed vs 11"}
{"iter":165,"slug":"cap-stack-imt2b","ts":"2026-05-16T00:00:00Z","status":"discarded","score":0.8451,"delta":-0.025,"n":75,"notes":"lr 5e-7 too gentle"}
{"iter":166,"slug":"cap-stack-imt5","ts":"2026-05-16T00:00:00Z","status":"kept","score":0.8687,"delta":-0.0015,"n":75,"notes":"5 examples close but slightly under 11"}
{"iter":167,"slug":"cap-stack-imt6b","ts":"2026-05-16T00:00:00Z","status":"discarded","score":0.8493,"delta":-0.021,"n":75,"notes":"different 6 examples regressed"}
{"iter":168,"slug":"cap-stack-imt-l4","ts":"2026-05-16T00:00:00Z","status":"discarded","score":0.8349,"delta":-0.035,"n":75,"notes":"4 layers regress"}
{"iter":169,"slug":"cap-ties-best","ts":"2026-05-16T00:00:00Z","status":"discarded","score":0.8477,"delta":-0.023,"n":75,"notes":"weighted-avg merge regressed"}
{"iter":170,"slug":"cap-imt-2e6","ts":"2026-05-16T00:00:00Z","status":"discarded","score":0.8652,"delta":-0.005,"n":75,"notes":"lr 2e-6 close but not as good as 1e-6"}
{"iter":171,"slug":"cap-imt-2ep","ts":"2026-05-16T00:00:00Z","status":"discarded","score":0.8445,"delta":-0.026,"n":75,"notes":"2 epochs at 1e-6 overshoots"}
{"iter":172,"slug":"cap-stack-iter2-5","ts":"2026-05-16T00:00:00Z","status":"discarded","score":0.8394,"delta":-0.031,"n":75,"notes":"5 iter2 dialogs on imt2 regressed"}
{"iter":173,"slug":"cap-combined-stack","ts":"2026-05-16T00:00:00Z","status":"discarded","score":0.8410,"delta":-0.029,"n":75,"notes":"single-layer combined regressed (order matters)"}
{"iter":174,"slug":"cap-imt-twice","ts":"2026-05-16T00:00:00Z","status":"discarded","score":0.8634,"delta":-0.007,"n":75,"notes":"stacking imt-tiny twice slight regression"}
{"iter":175,"slug":"cap-imt-8e7","ts":"2026-05-16T00:00:00Z","status":"discarded","score":0.8464,"delta":-0.024,"n":75,"notes":"lr 8e-7 still bad"}
{"iter":176,"slug":"cap-stack-sgd2","ts":"2026-05-16T00:00:00Z","status":"kept","score":0.8799,"delta":+0.020,"n":75,"notes":"SGD middle layer at lr 5e-5; NEW BEST 0.8799"}
{"iter":177,"slug":"cap-sgd-trip","ts":"2026-05-16T00:00:00Z","status":"discarded","score":0.8508,"delta":-0.029,"n":75,"notes":"IMT on sgd2 hurt (SGD base already optimal)"}
{"iter":178,"slug":"cap-sgd-lr1e-4-ep1-r4","ts":"2026-05-16T00:00:00Z","status":"discarded","score":0.8325,"delta":-0.05,"n":75,"notes":"lr 1e-4 too high"}
{"iter":179,"slug":"cap-sgd-lr2e-5-ep1-r4","ts":"2026-05-16T00:00:00Z","status":"discarded","score":0.8478,"delta":-0.03,"n":75,"notes":"lr 2e-5 below sweet spot"}
{"iter":180,"slug":"cap-sgd-lr5e-5-ep2-r4","ts":"2026-05-16T00:00:00Z","status":"discarded","score":0.8570,"delta":-0.02,"n":75,"notes":"2 epochs slightly worse"}
{"iter":181,"slug":"cap-sgd-lr5e-5-ep1-r8","ts":"2026-05-16T00:00:00Z","status":"discarded","score":0.8131,"delta":-0.07,"n":75,"notes":"rank 8 hurts"}
{"iter":182,"slug":"cap-sgd-trip-3e6","ts":"2026-05-16T00:00:00Z","status":"discarded","score":0.7981,"delta":-0.08,"n":75,"notes":"IMT layer lr 3e-6 too high"}
{"iter":183,"slug":"cap-stack-sgd3","ts":"2026-05-16T00:00:00Z","status":"discarded","score":0.8746,"delta":-0.005,"n":75,"notes":"sgd-run3 base close to sgd2 base"}
{"iter":184,"slug":"cap-stack-s7","ts":"2026-05-16T00:00:00Z","status":"discarded","score":0.8776,"delta":-0.002,"n":75,"notes":"shuffle seed 7 close"}
{"iter":185,"slug":"cap-stack-s42","ts":"2026-05-16T00:00:00Z","status":"discarded","score":0.8423,"delta":-0.037,"n":75,"notes":"shuffle s42 worse"}
{"iter":186,"slug":"cap-stack-s137","ts":"2026-05-16T00:00:00Z","status":"discarded","score":0.8271,"delta":-0.053,"n":75,"notes":"shuffle s137 worse"}
{"iter":187,"slug":"cap-sgd-imt-sgd","ts":"2026-05-16T00:00:00Z","status":"discarded","score":0.8453,"delta":-0.035,"n":75,"notes":"IMT layer with SGD lr 5e-5 too aggressive"}
{"iter":188,"slug":"cap-s7-imt","ts":"2026-05-16T00:00:00Z","status":"discarded","score":0.8106,"delta":-0.07,"n":75,"notes":"IMT on s7 base regressed hard"}
{"iter":189,"slug":"cap-merge-sgd2-s7","ts":"2026-05-16T00:00:00Z","status":"discarded","score":0.8500,"delta":-0.03,"n":75,"notes":"merge regressed"}
{"iter":190,"slug":"cap-merge-sgd2-s7-w8","ts":"2026-05-16T00:00:00Z","status":"discarded","score":0.8725,"delta":-0.007,"n":75,"notes":"0.8 weighted closer"}
{"iter":191,"slug":"cap-merge-sgd2-s7-w9","ts":"2026-05-16T00:00:00Z","status":"discarded","score":0.8675,"delta":-0.012,"n":75,"notes":"0.9 weighted hurts"}
{"iter":192,"slug":"cap-sgd2-imt-low","ts":"2026-05-16T00:00:00Z","status":"discarded","score":0.8484,"delta":-0.025,"n":75,"notes":"lr 5e-7 IMT on sgd2 base still hurts"}
{"iter":193,"slug":"cap-stack-sgd2-verified","ts":"2026-05-16T00:00:00Z","status":"kept","score":0.8732,"delta":+0.0038,"n":75,"notes":"cap-stack-sgd2 re-verified stable 0.8732 (was 0.8799 one-off); new STABLE BEST over iter 102's 0.8694"}
{"iter":194,"slug":"cap-imt2-sgd","ts":"2026-05-16T00:00:00Z","status":"discarded","score":0.8280,"delta":-0.05,"n":75,"notes":"SGD layer on imt2 base hurt"}
{"iter":195,"slug":"cap-direct-sgd","ts":"2026-05-16T00:00:00Z","status":"discarded","score":0.8498,"delta":-0.023,"n":75,"notes":"direct SGD on winning-64 (no 2-stage) hurt"}
{"iter":196,"slug":"cap-sgd2-mini","ts":"2026-05-16T00:00:00Z","status":"discarded","score":0.8186,"delta":-0.055,"n":75,"notes":"tiny SGD layer hurt"}
{"iter":197,"slug":"cap-stack-sgd2-final","ts":"2026-05-16T00:00:00Z","status":"kept","score":0.8799,"delta":+0.011,"n":75,"notes":"FINAL BEST: re-verified at 0.8799 (variance: also seen at 0.8732). Beats iter 102 stable by +0.011"}
{"iter":198,"slug":"cap-sgd3-s7","ts":"2026-05-16T00:00:00Z","status":"discarded","score":0.8340,"delta":-0.046,"n":75,"notes":"different base + shuffle hurt"}
{"iter":199,"slug":"cap-sgd-imt-mid","score":0.8285,"status":"discarded","notes":"IMT as middle layer regressed"}
{"iter":200,"slug":"cap-sgd-po","score":0.8637,"status":"discarded","notes":"PO as middle layer below 0.88"}
{"iter":201,"slug":"cap-stack-sgd2-3e5","score":0.8504,"status":"discarded","notes":"lr 3e-5 too low"}
{"iter":202,"slug":"cap-stack-sgd2-7e5","score":0.8564,"status":"discarded","notes":"lr 7e-5 too high"}
{"iter":203,"slug":"cap-sgd2-a16","score":0.8268,"status":"discarded","notes":"alpha 16 worse"}
{"iter":204,"slug":"cap-sgd2-a64","score":0.8402,"status":"discarded","notes":"alpha 64 worse"}
{"iter":205,"slug":"cap-sgd2-a8","score":0.8108,"status":"discarded","notes":"alpha 8 worst"}
{"iter":206,"slug":"cap-stack-sgd1","score":0.8016,"status":"discarded","notes":"sgd-run1 base too low"}
{"iter":207,"slug":"cap-sgd-run7","score":0.7878,"status":"discarded","notes":"fresh SGD base bad seed"}
{"iter":208,"slug":"variance-discovery","score":null,"status":"note","notes":"cap-stack-sgd2 measurements vary 0.80-0.88 across server restarts. Real eval variance."}
